{
  "$schema": "./evolution.schema.json",
  "version": "1.4.0",
  "objective": "持续把 MarkZ 建设成克制、可靠、易发现、愿意继续阅读的成熟个人博客，并让 AI 协作从当前证据自动选择下一项改进。",
  "cadence": {
    "schedule": "weekly and after evolution-source changes",
    "workflow": ".github/workflows/markz-evolve.yaml"
  },
  "selectionPolicy": {
    "formula": "impact * urgency * confidence / effort",
    "tieBreakers": ["lower risk", "capability id"],
    "approvalRequired": [
      "critical production changes",
      "privacy scope expansion",
      "destructive operations",
      "new external services or secrets"
    ]
  },
  "guardrails": [
    "A gap is evidence for prioritization, not permission to bypass repository boundaries.",
    "Generated output, third-party plugin caches, and independent product identities remain read-only boundaries.",
    "Every completed capability must have a deterministic check and the validation commands listed here.",
    "The report may update an issue automatically; code and production changes still use the governed review and deployment flow."
  ],
  "capabilities": [
    {
      "id": "editorial-discovery",
      "track": "content",
      "name": "搜索与语义发现",
      "description": "页面 canonical、RSS 自动发现、文章元数据和结构化数据与 sitemap 使用同一规范 URL。",
      "impact": 5,
      "urgency": 5,
      "confidence": 5,
      "effort": 2,
      "risk": "medium",
      "check": "editorial-seo",
      "nextAction": "补齐 canonical、BlogPosting、Open Graph article dates 和回退站 noindex，并锁入构建检查。",
      "validation": ["npm test", "npm run build", "npm run quality:build"]
    },
    {
      "id": "editorial-feed",
      "track": "content",
      "name": "纯文章订阅源",
      "description": "博客 RSS 只发布成稿文章，具备自发现链接和稳定的文章 URL。",
      "impact": 5,
      "urgency": 5,
      "confidence": 5,
      "effort": 2,
      "risk": "medium",
      "check": "editorial-rss",
      "nextAction": "从同步后的文章索引生成独立 RSS 和 robots.txt，拒绝首页、标签和归档混入。",
      "validation": ["npm test", "npm run build", "npm run quality:build"]
    },
    {
      "id": "font-single-source",
      "track": "reader",
      "name": "字体单一权威来源",
      "description": "页面只加载设计令牌声明的字体，不重复请求 Quartz 默认字体。",
      "impact": 4,
      "urgency": 4,
      "confidence": 5,
      "effort": 1,
      "risk": "low",
      "check": "font-authority",
      "nextAction": "停用重复字体插件并在构建 HTML 中断言只有一条受治理字体样式表。",
      "validation": ["npm run design:check", "npm run build", "npm run quality:build"]
    },
    {
      "id": "reader-continuity",
      "track": "reader",
      "name": "文章继续阅读",
      "description": "读者读完文章后能看到少量、可解释且不做成卡片墙的相关成稿。",
      "impact": 5,
      "urgency": 5,
      "confidence": 5,
      "effort": 2,
      "risk": "medium",
      "check": "reader-continuity",
      "nextAction": "根据显式文章链接、同集合与标签生成最多三条继续阅读，并覆盖移动端和双主题。",
      "validation": ["npm test", "npm run build", "npm run quality:web"]
    },
    {
      "id": "anonymous-feedback",
      "track": "reader",
      "name": "匿名阅读反馈",
      "description": "文章浏览、点赞和博客访客提供轻量反馈，同时不保存 IP 或用户代理。",
      "impact": 3,
      "urgency": 3,
      "confidence": 5,
      "effort": 2,
      "risk": "high",
      "check": "anonymous-feedback",
      "nextAction": "使用独立 Node 与 SQLite 服务提供幂等匿名反馈，并保持产品域名边界。",
      "validation": [
        "npm test",
        "npm run quality:build",
        "npm run quality:web",
        "npm run smoke:production"
      ]
    },
    {
      "id": "runtime-backup",
      "track": "runtime",
      "name": "互动数据自动备份",
      "description": "SQLite 互动数据具备自动、一致性校验、保留策略和服务器故障之外的恢复副本。",
      "impact": 5,
      "urgency": 5,
      "confidence": 5,
      "effort": 4,
      "risk": "critical",
      "check": "runtime-backup",
      "nextAction": "获得明确同意后创建仓库外专用 age identity，只提交 public recipient，启用审批变量，并用首次 Artifact 下载恢复证明异地路径。",
      "validation": [
        "npm test",
        "npm run evals:check",
        "npm run evolve:report",
        "npm run verify",
        "npm run smoke:production"
      ]
    },
    {
      "id": "production-observability",
      "track": "runtime",
      "name": "生产持续观测",
      "description": "定时发布后检查所有域名、关键页面、运行时 API、图谱和公网端口所有权。",
      "impact": 5,
      "urgency": 4,
      "confidence": 5,
      "effort": 2,
      "risk": "critical",
      "check": "production-observability",
      "nextAction": "让发布工作流定时运行全域名 smoke，并保留浏览器证据。",
      "validation": ["npm run ai:check", "npm run smoke:production"]
    },
    {
      "id": "link-debt-zero",
      "track": "content",
      "name": "公开断链清零",
      "description": "Obsidian 迁移留下的断链有显式债务账本，并持续减少到零。",
      "impact": 4,
      "urgency": 3,
      "confidence": 5,
      "effort": 4,
      "risk": "medium",
      "check": "link-debt",
      "nextAction": "按来源笔记修复现有断链，每修一批就收紧 baseline，禁止用放宽检查掩盖问题。",
      "validation": ["npm test", "npm run build", "npm run quality:build"]
    },
    {
      "id": "article-social-images",
      "track": "content",
      "name": "文章级分享图",
      "description": "每篇文章分享时能展示标题和品牌，而不是所有文章共用一张通用卡片。",
      "impact": 3,
      "urgency": 3,
      "confidence": 4,
      "effort": 3,
      "risk": "medium",
      "check": "article-social-images",
      "nextAction": "从设计令牌和文章 frontmatter 生成版本化分享图，并控制构建时间与字体一致性。",
      "validation": ["npm run design:check", "npm run build", "npm run quality:build"]
    },
    {
      "id": "evolution-control-plane",
      "track": "ai",
      "name": "AI 进化控制面",
      "description": "成熟度能力、当前证据、优先级和下一动作由机器报告，并定时更新唯一 GitHub 任务。",
      "impact": 5,
      "urgency": 5,
      "confidence": 5,
      "effort": 3,
      "risk": "high",
      "check": "evolution-control-plane",
      "nextAction": "建立 evolution manifest、确定性探针、排序报告、项目 Skill 流程和定时 issue 更新。",
      "validation": ["npm run ai:check", "npm run evolve:check", "npm test"]
    },
    {
      "id": "decision-log-contract",
      "track": "ai",
      "name": "决策完整性门禁",
      "description": "每一条用户纠偏决策都连续编号并具备触发、决策、反例、边界和锁定证据。",
      "impact": 4,
      "urgency": 4,
      "confidence": 5,
      "effort": 2,
      "risk": "high",
      "check": "decision-contract",
      "nextAction": "从硬编码旧决策编号升级为解析整份决策日志的结构与连续性检查。",
      "validation": ["npm run ai:check", "npm test"]
    },
    {
      "id": "live-eval-evidence",
      "track": "ai",
      "name": "实时评测证据",
      "description": "进化报告每次都运行当前 eval，而不是把历史人工账本当作最新结论。",
      "impact": 4,
      "urgency": 4,
      "confidence": 5,
      "effort": 2,
      "risk": "medium",
      "check": "live-eval-evidence",
      "nextAction": "把确定性 eval 结果注入每周报告和 CI artifact，同时保留历史人工结果作为审计记录。",
      "validation": ["npm run evals:check", "npm run evolve:report", "npm test"]
    },
    {
      "id": "ci-action-lifecycle",
      "track": "ai",
      "name": "CI Action 生命周期",
      "description": "远程 GitHub Actions 使用当前 Node 24 兼容发布的不可变提交，并持续获得自动依赖更新。",
      "impact": 4,
      "urgency": 5,
      "confidence": 5,
      "effort": 1,
      "risk": "high",
      "check": "ci-action-lifecycle",
      "nextAction": "把远程 Action 固定到完整 commit SHA，保留精确版本注释，并由 Dependabot 至少每周检查更新。",
      "validation": ["npm run ai:check", "npm run evals:check", "npm test"]
    },
    {
      "id": "edge-security-headers",
      "track": "runtime",
      "name": "全站安全响应基线",
      "description": "所有 HTTPS 页面、API、静态资源和错误响应一致返回集中治理的 HSTS、MIME、防嵌入与 Referrer 策略。",
      "impact": 5,
      "urgency": 5,
      "confidence": 5,
      "effort": 2,
      "risk": "critical",
      "check": "security-header-policy",
      "nextAction": "集中安全响应头，覆盖每个 TLS server 和自行声明 add_header 的 location，并在生产检查 2xx、静态资源与 404。",
      "validation": ["npm test", "npm run verify", "npm run smoke:production"]
    },
    {
      "id": "content-security-policy",
      "track": "runtime",
      "name": "内容安全策略",
      "description": "博客与笔记使用可执行、可测试且不依赖 unsafe-inline 脚本的 Content Security Policy 限制资源来源。",
      "impact": 5,
      "urgency": 4,
      "confidence": 5,
      "effort": 3,
      "risk": "critical",
      "check": "content-security-policy",
      "nextAction": "先外置 Quartz 内联可执行脚本并盘点字体、图片、连接源，再发布 CSP，构建和浏览器门禁拒绝策略违规。",
      "validation": ["npm test", "npm run quality:web", "npm run smoke:production"]
    }
  ]
}
